{
  "schema_version": "1.0.0",
  "postgres_major": 16,
  "schema_version_value": 20261009000100,
  "migration_manifest_sha256": "b0eea2adef67e09a60eaccf2de94ce9c98b1dfe73435cf8c25eced1940d38b19",
  "required_table_count": 118,
  "partition_count": 5,
  "fixture_id": "FIX-R2-POSTGRES-001",
  "automation": "cargo test --locked -p gateway-storage --test postgres_r2",
  "status": "not_run"
}
